{"$schema":"http://json-schema.org/draft-07/schema#","properties":{"$schema":{"const":"./i18n-schema.json"},"help_title":{"type":"string","pattern":"^(?=.*\\{\\|version\\|\\})(?=.*\\{\\|lastChange\\|\\}).*$"},"cmdDesc_pause":{"type":"string"},"cmdDesc_quit":{"type":"string"},"cmdDesc_help_main":{"type":"string"},"cmdDesc_help_suggest":{"type":"string"},"cmdDesc_help_withArg":{"type":"string","pattern":"^(?=.*\\{\\|subject\\|\\}).*$"},"cmdDesc_language_set":{"type":"string"},"cmdDesc_language_setSuggest":{"type":"string","pattern":"^(?=.*\\{\\|lang\\|\\}).*$"},"cmdDesc_language_show":{"type":"string"},"cmdDesc_resume1":{"type":"string"},"cmdDesc_resume2":{"type":"string"},"cmdDesc_set_resetAll":{"type":"string"},"cmdDesc_set_resetPref":{"type":"string","pattern":"^(?=.*\\{\\|pref\\|\\}).*$"},"cmdDesc_set_resetSuggest":{"type":"string"},"cmdDesc_set_setNonTogglePref":{"type":"string","pattern":"^(?=.*\\{\\|pref\\|\\}).*$"},"cmdDesc_set_setNonToggleSuggest":{"type":"string"},"cmdDesc_set_showAll":{"type":"string"},"cmdDesc_set_showDiffer":{"type":"string"},"cmdDesc_set_showPref":{"type":"string","pattern":"^(?=.*\\{\\|pref\\|\\}).*$"},"cmdDesc_set_showSuggest":{"type":"string"},"cmdDesc_set_suggest1":{"type":"string"},"cmdDesc_set_suggest2":{"type":"string"},"cmdDesc_set_toggleInvPref":{"type":"string","pattern":"^(?=.*\\{\\|pref\\|\\}).*$"},"cmdDesc_set_toggleInvSuggest":{"type":"string"},"cmdDesc_set_toggleOffPref":{"type":"string","pattern":"^(?=.*\\{\\|pref\\|\\}).*$"},"cmdDesc_set_toggleOffSuggest":{"type":"string"},"cmdDesc_set_toggleOnPref":{"type":"string","pattern":"^(?=.*\\{\\|pref\\|\\}).*$"},"cmdDesc_start_difficulty":{"type":"string","pattern":"^(?=.*\\{\\|difficulty\\|\\}).*$"},"cmdDesc_start_subject":{"type":"string"},"cmdDesc_write":{"type":"string"},"cmdDesc_writeAndQuit":{"type":"string"},"cmdDesc_writeLike":{"type":"string"},"form_reset":{"type":"string"},"form_save":{"type":"string"},"gameBtn_goBack":{"type":"string"},"gameBtn_new_text":{"type":"string"},"gameBtn_resume_disabledReason":{"type":"string"},"gameBtn_resume_text":{"type":"string"},"gameBtn_selectDifficulty":{"type":"string"},"gameBtn_start":{"type":"string"},"modes_insert":{"type":"string"},"modes_normal":{"type":"string"},"modes_notes":{"type":"string"},"modes_visual":{"type":"string"},"prefs_tabs_edit":{"type":"string"},"prefs_tabs_show":{"type":"string"},"prefs_accessibility_less":{"type":"string"},"prefs_accessibility_more":{"type":"string"},"prefs_accessibility_system":{"type":"string"},"prefs_groups_sudoku":{"type":"string"},"prefs_groups_user":{"type":"string"},"prefs_groups_vim":{"type":"string"},"prefs_names_autoNoteDeletion":{"type":"string"},"prefs_names_autoSave":{"type":"string"},"prefs_names_autoValidation":{"type":"string"},"prefs_names_colorSchema":{"type":"string"},"prefs_names_colorTheme":{"type":"string"},"prefs_names_contrast":{"type":"string"},"prefs_names_cursorBox":{"type":"string"},"prefs_names_cursorCol":{"type":"string"},"prefs_names_cursorRow":{"type":"string"},"prefs_names_highlight":{"type":"string"},"prefs_names_history":{"type":"string"},"prefs_names_iconTheme":{"type":"string"},"prefs_names_markRelatedNumbers":{"type":"string"},"prefs_names_motionReduce":{"type":"string"},"prefs_names_numbers":{"type":"string"},"prefs_names_relativeNumbers":{"type":"string"},"prefs_names_remainingNumbers":{"type":"string"},"prefs_names_timer":{"type":"string"},"prefs_schema_dark":{"type":"string"},"prefs_schema_light":{"type":"string"},"prefs_schema_system":{"type":"string"},"prefs_showToggle":{"type":"string"},"prefs_toggle_false":{"type":"string"},"prefs_toggle_true":{"type":"string"},"statusBar_modesDisabledReason":{"type":"string"},"statusBar_posDesc":{"type":"string","pattern":"^(?=.*\\{\\|col\\|\\})(?=.*\\{\\|row\\|\\}).*$"},"sync_false":{"type":"string"},"sync_true":{"type":"string"}},"required":["$schema","help_title","cmdDesc_pause","cmdDesc_quit","cmdDesc_help_main","cmdDesc_help_suggest","cmdDesc_help_withArg","cmdDesc_language_set","cmdDesc_language_setSuggest","cmdDesc_language_show","cmdDesc_resume1","cmdDesc_resume2","cmdDesc_set_resetAll","cmdDesc_set_resetPref","cmdDesc_set_resetSuggest","cmdDesc_set_setNonTogglePref","cmdDesc_set_setNonToggleSuggest","cmdDesc_set_showAll","cmdDesc_set_showDiffer","cmdDesc_set_showPref","cmdDesc_set_showSuggest","cmdDesc_set_suggest1","cmdDesc_set_suggest2","cmdDesc_set_toggleInvPref","cmdDesc_set_toggleInvSuggest","cmdDesc_set_toggleOffPref","cmdDesc_set_toggleOffSuggest","cmdDesc_set_toggleOnPref","cmdDesc_start_difficulty","cmdDesc_start_subject","cmdDesc_write","cmdDesc_writeAndQuit","cmdDesc_writeLike","form_reset","form_save","gameBtn_goBack","gameBtn_new_text","gameBtn_resume_disabledReason","gameBtn_resume_text","gameBtn_selectDifficulty","gameBtn_start","modes_insert","modes_normal","modes_notes","modes_visual","prefs_tabs_edit","prefs_tabs_show","prefs_accessibility_less","prefs_accessibility_more","prefs_accessibility_system","prefs_groups_sudoku","prefs_groups_user","prefs_groups_vim","prefs_names_autoNoteDeletion","prefs_names_autoSave","prefs_names_autoValidation","prefs_names_colorSchema","prefs_names_colorTheme","prefs_names_contrast","prefs_names_cursorBox","prefs_names_cursorCol","prefs_names_cursorRow","prefs_names_highlight","prefs_names_history","prefs_names_iconTheme","prefs_names_markRelatedNumbers","prefs_names_motionReduce","prefs_names_numbers","prefs_names_relativeNumbers","prefs_names_remainingNumbers","prefs_names_timer","prefs_schema_dark","prefs_schema_light","prefs_schema_system","prefs_showToggle","prefs_toggle_false","prefs_toggle_true","statusBar_modesDisabledReason","statusBar_posDesc","sync_false","sync_true"],"additionalProperties":false,"title":"vimdoku-${principal.name}-i18n","type":"object"}