{
	"$schema": "./i18n-schema.json",
	"cmdDesc_help_main": "Open dialog and display the help app.",
	"cmdDesc_help_suggest": "Like \":help\", additionally jump to the tag {subject}.",
	"cmdDesc_help_withArg": "Open dialog and display the help of {|subject|}.",
	"cmdDesc_language_set": "Sets the current language to {lang}.",
	"cmdDesc_language_setSuggest": "Sets the current language to {|lang|}.",
	"cmdDesc_language_show": "Show the current value of language.",
	"cmdDesc_pause": "Pause the current game.",
	"cmdDesc_quit": "Close the current screen or dialog.",
	"cmdDesc_resume1": "Resume the current game.",
	"cmdDesc_resume2": "Resume the saved game only if no game active.",
	"cmdDesc_set_resetAll": "Reset all preferences.",
	"cmdDesc_set_resetPref": "Reset value of {|pref|}.",
	"cmdDesc_set_resetSuggest": "Reset {preference} to it's default value.",
	"cmdDesc_set_setNonTogglePref": "Assign to {|pref|} the {value}.",
	"cmdDesc_set_setNonToggleSuggest": "String or Number preference: Assign to {preference} the {value}.",
	"cmdDesc_set_showAll": "Show all preferences.",
	"cmdDesc_set_showDiffer": "Show all preferences that differ from their default value.",
	"cmdDesc_set_showPref": "Show value of {|pref|}.",
	"cmdDesc_set_showSuggest": "Show value of {preference}.",
	"cmdDesc_set_suggest1": "Toggle preference: Set, switch it on.",
	"cmdDesc_set_suggest2": "String or Number preference: Shows it's value",
	"cmdDesc_set_toggleInvPref": "Invert value of {|pref|}.",
	"cmdDesc_set_toggleInvSuggest": "Toggle preference: Invert value.",
	"cmdDesc_set_toggleOffPref": "Set, {|pref|} to switch off.",
	"cmdDesc_set_toggleOffSuggest": "Toggle preference: Set, switch it off.",
	"cmdDesc_set_toggleOnPref": "Set, {|pref|} to switch it on.",
	"cmdDesc_start_difficulty": "Start new game with the {|difficulty|} difficulty.",
	"cmdDesc_start_subject": "Start new game with the selected difficulty.",
	"cmdDesc_write": "Save the current game.",
	"cmdDesc_writeAndQuit": "Save the current game and close the current screen or dialog.",
	"cmdDesc_writeLike": "Like \":wq\", but save only when changes have been made.",
	"form_reset": "Reset to default values",
	"form_save": "Save all",
	"gameBtn_goBack": "Go back",
	"gameBtn_new_text": "New game",
	"gameBtn_resume_disabledReason": "No saved game.",
	"gameBtn_resume_text": "Resume game",
	"gameBtn_selectDifficulty": "Select difficulty",
	"gameBtn_start": "Start new game",
	"help_title": "For Vimdoku version {|version|}. last change: {|lastChange|}.",
	"modes_insert": "INSERT",
	"modes_normal": "NORMAL",
	"modes_notes": "NOTES",
	"modes_visual": "VISUAL",
	"prefs_accessibility_less": "Less",
	"prefs_accessibility_more": "More",
	"prefs_accessibility_system": "System",
	"prefs_groups_sudoku": "Sudoku",
	"prefs_groups_user": "User",
	"prefs_groups_vim": "Vim",
	"prefs_names_autoNoteDeletion": "Auto note deletion",
	"prefs_names_autoSave": "Auto save",
	"prefs_names_autoValidation": "Auto Validation",
	"prefs_names_colorSchema": "Color Schema",
	"prefs_names_colorTheme": "Color Theme",
	"prefs_names_contrast": "Contrast",
	"prefs_names_cursorBox": "Cursor box",
	"prefs_names_cursorCol": "Cursor column",
	"prefs_names_cursorRow": "Cursor row",
	"prefs_names_highlight": "Highlight",
	"prefs_names_history": "history",
	"prefs_names_iconTheme": "Icon Theme",
	"prefs_names_markRelatedNumbers": "mark Related Numbers",
	"prefs_names_motionReduce": "Motion reduce",
	"prefs_names_numbers": "Numbers",
	"prefs_names_relativeNumbers": "Relative numbers",
	"prefs_names_remainingNumbers": "Count remain Numbers",
	"prefs_names_timer": "Timer",
	"prefs_schema_dark": "dark",
	"prefs_schema_light": "Light",
	"prefs_schema_system": "System",
	"prefs_showToggle": "Show only that differ from default value",
	"prefs_tabs_edit": "Edit",
	"prefs_tabs_show": "Show",
	"prefs_toggle_false": "off",
	"prefs_toggle_true": "on",
	"statusBar_modesDisabledReason": "The insertion mode can only be changed on the game screen.",
	"statusBar_posDesc": "Row {|row|}, Col {|col|}.",
	"sync_false": "Unsaved",
	"sync_true": "Saved"
}
