{
	"$schema": "./i18n-schema.json",
	"cmdDesc_help_main": "Abre un dialogo y muestra las instrucciones de la aplicación.",
	"cmdDesc_help_suggest": "Parecido a \":help\", con la adicción de brincar a la etiqueta {subject}",
	"cmdDesc_help_withArg": "Abre un dialogo y muestra las instrucciones sobre {|subject|}",
	"cmdDesc_language_set": "Establece el lenguaje actual como {lang}.",
	"cmdDesc_language_setSuggest": "Establece el lenguaje actual como {|lang|}.",
	"cmdDesc_language_show": "Lenguaje",
	"cmdDesc_pause": "Pausa la partida actual.",
	"cmdDesc_quit": "Cierra la ventana o dialog actual.",
	"cmdDesc_resume1": "Continua con la partida actual.",
	"cmdDesc_resume2": "Continua con la partida guardada.",
	"cmdDesc_set_resetAll": "Restablece todas las preferencias",
	"cmdDesc_set_resetPref": "Restablece {|pref|} a su valor por defecto.",
	"cmdDesc_set_resetSuggest": "Restablece la preferencia a su valor por defecto.",
	"cmdDesc_set_setNonTogglePref": "Establece {value} como el valor de {|pref|}.",
	"cmdDesc_set_setNonToggleSuggest": "Preferencia de texto o numero: Establece {value} como su valor.",
	"cmdDesc_set_showAll": "Muestra todas las preferencias.",
	"cmdDesc_set_showDiffer": "Muestra todas las preferencias que difieren su valor por defecto.",
	"cmdDesc_set_showPref": "Muestra el valor de {|pref|}.",
	"cmdDesc_set_showSuggest": "Muestra el valor de la preferencia.",
	"cmdDesc_set_suggest1": "Preferencia de interruptor: Establecer valor, encender",
	"cmdDesc_set_suggest2": "Preferencia de texto o numero: Muestra su valor.",
	"cmdDesc_set_toggleInvPref": "Invierte el valor de {|pref|}",
	"cmdDesc_set_toggleInvSuggest": "Preferencia de interruptor: Invierte el valor.",
	"cmdDesc_set_toggleOffPref": "Establecer valor, apagar {|pref|}.",
	"cmdDesc_set_toggleOffSuggest": "Preferencia de interruptor: Establecer valor, apagar.",
	"cmdDesc_set_toggleOnPref": "Establecer valor, encender {|pref|}.",
	"cmdDesc_start_difficulty": "Inicia una nueva partida en la dificultad: {|difficulty|}.",
	"cmdDesc_start_subject": "Inicia una nueva partida con la dificultad seleccionada.",
	"cmdDesc_write": "Guarda la partida actual.",
	"cmdDesc_writeAndQuit": "Guarda la partida actual y cierra la ventana o dialogo actual.",
	"cmdDesc_writeLike": "Como \":wq\", pero solo si se han echo cambios.",
	"form_reset": "Restablece a los valores por defecto",
	"form_save": "Guarda Todo",
	"gameBtn_goBack": "Regresar",
	"gameBtn_new_text": "Nuevo juego",
	"help_title": "Para Vimdoku versión {|version|}. Ultimo cambio: {|lastChange|}.",
	"gameBtn_resume_disabledReason": "No hay partidas guardadas.",
	"gameBtn_resume_text": "Continuar la partida",
	"gameBtn_selectDifficulty": "Seleccionar dificultad",
	"gameBtn_start": "Iniciar nueva partida",
	"modes_insert": "INSERCIÓN",
	"modes_normal": "NORMAL",
	"modes_notes": "ANOTACIÓN",
	"modes_visual": "VISUAL",
	"prefs_accessibility_less": "Menos",
	"prefs_accessibility_more": "más",
	"prefs_accessibility_system": "Sistema",
	"prefs_groups_sudoku": "Sudoku",
	"prefs_groups_user": "Usuario",
	"prefs_groups_vim": "Vim",
	"prefs_names_autoNoteDeletion": "Notas auto eliminadas",
	"prefs_names_autoSave": "Auto guardado",
	"prefs_names_autoValidation": "Validación automática",
	"prefs_names_colorSchema": "Esquema de color",
	"prefs_names_colorTheme": "Tema de colores",
	"prefs_names_contrast": "Contraste",
	"prefs_names_cursorBox": "Caja de cursor",
	"prefs_names_cursorCol": "Columna de cursor",
	"prefs_names_cursorRow": "Fila de cursor",
	"prefs_names_highlight": "Resaltado",
	"prefs_names_history": "Historial",
	"prefs_names_iconTheme": "Tema de iconos",
	"prefs_names_markRelatedNumbers": "Marcar notas relacionadas",
	"prefs_names_motionReduce": "Reducción de movimiento",
	"prefs_names_numbers": "Números",
	"prefs_names_relativeNumbers": "Números relativos",
	"prefs_names_remainingNumbers": "Ver números restantes",
	"prefs_names_timer": "Temporizador",
	"prefs_schema_dark": "Obscuro",
	"prefs_schema_light": "Luminoso",
	"prefs_schema_system": "Sistema",
	"prefs_showToggle": "Muestra el valor actual del lenguaje.",
	"prefs_tabs_edit": "Editar",
	"prefs_tabs_show": "Visualizar",
	"prefs_toggle_false": "no",
	"prefs_toggle_true": "si",
	"statusBar_modesDisabledReason": "El modo de inserción solo puede ser cambiado en la pantalla de juego.",
	"statusBar_posDesc": "Fila {|row|}, Columna {|col|}.",
	"sync_false": "Sin guardar",
	"sync_true": "Guardado"
}
